{"schema":"ql.m2-engine-request/v1","registry_revision":"c8dc7a61731b879ec68915af45217e96488283045d74f779dcf6123569aa98c0","stamp":{"identity":{"event_ref":"fixture:m2-event","profile_generation":1},"source_ref":"fixture:m2-source","contract_ref":"ql.m2-engine-request/v1"},"at_unix_ms":1000,"tick12":1,"degree720":1,"modal_coefficients":[[-3,-2],[-2,-1],[-1,0],[0,1],[1,2],[2,-2],[3,-1],[-3,0],[-2,1],[-1,2],[0,-2],[1,-1],[2,0],[3,1],[-3,2],[-2,-2],[-1,-1],[0,0],[1,1],[2,2],[3,-2],[-3,-1],[-2,0],[-1,1],[0,2],[1,-2],[2,-1],[3,0],[-3,1],[-2,2],[-1,-2],[0,-1],[1,0],[2,1],[3,2],[-3,-2],[-2,-1],[-1,0],[0,1],[1,2],[2,-2],[3,-1],[-3,0],[-2,1],[-1,2],[0,-2],[1,-1],[2,0],[3,1],[-3,2],[-2,-2],[-1,-1],[0,0],[1,1],[2,2],[3,-2],[-3,-1],[-2,0],[-1,1],[0,2],[1,-2],[2,-1],[3,0],[-3,1],[-2,2],[-1,-2],[0,-1],[1,0],[2,1],[3,2],[-3,-2],[-2,-1]],"mef_conditions":[0,6,36,71],"context_frames":["CF3"],"selections":[{"table":"tattva","index":31},{"table":"shem","index":0},{"table":"maqam","index":0},{"table":"asma","index":2},{"table":"mantra","index":50},{"table":"planet","index":7}],"m1_excitation":{"stamp":{"identity":{"event_ref":"fixture:m2-event","profile_generation":1},"source_ref":"fixture:m2-source","contract_ref":"ql.m2-engine-request/v1"},"topology_ref":"fixture:m1-topology","audio_octet":[0.0,0.0,0.0,0.0,0.0,0.0,0.0,0.0],"nodal_quartet":[0.0,0.0,0.0,0.0]},"world_observations":[{"planet_id":0,"longitude_degrees":0.1,"provider_ref":"fixture:sky-input","source_revision":"fixture:not-live","observed_at_unix_ms":900},{"planet_id":1,"longitude_degrees":90.1,"provider_ref":"fixture:sky-input","source_revision":"fixture:not-live","observed_at_unix_ms":900}],"resonator":null,"vimarsha":{"stamp":{"identity":{"event_ref":"fixture:m2-event","profile_generation":1},"source_ref":"fixture:m2-source","contract_ref":"ql.m2-engine-request/v1"},"lens":6,"musical_mode":3,"harmonic_ratio":[9,8],"pose_ordinal":0,"pose_source_ref":"fixture:shared-m3-pose/0"}}
